{
  "schema_version": "1.0",
  "decision": {
    "decision_type": "tool_choice",
    "evaluation_name": "agent.tool_choice_appropriate",
    "chosen": {
      "kind": "inline",
      "value": "search_database"
    }
  },
  "subject": {
    "harness": "generic-jsonl",
    "run_id": "run-0002"
  },
  "evidence": [
    {
      "evidence_id": "evidence-1",
      "kind": "command_result",
      "command_name": "project-test-suite",
      "exit_code": 0
    }
  ]
}
