{
  "schema_version": "1.0",
  "decision": {
    "decision_type": "tool_choice",
    "evaluation_name": "agent.tool_choice_appropriate",
    "chosen": {
      "kind": "inline",
      "value": "search_database"
    }
  },
  "subject": {
    "harness": "generic-jsonl",
    "run_id": "run-0002"
  },
  "evidence": [
    {
      "evidence_id": "evidence-1",
      "kind": "file_state",
      "path": "src/auth/session.py",
      "artifact_digest": {
        "algorithm": "sha256",
        "digest": "9f86d081884c7d659a2feaa0c55ad015a3bf4f1b2b0b822cd15d6c15b0f00a08",
        "byte_length": 4096
      }
    }
  ]
}
