{
  "schema_version": "1.0",
  "decision": {
    "decision_type": "tool_choice",
    "evaluation_name": "agent.tool_choice_appropriate",
    "chosen": {
      "kind": "absent",
      "reason": "redacted"
    }
  },
  "subject": {
    "harness": "generic-jsonl",
    "run_id": "run-0002"
  },
  "evidence": []
}
