[
  {
    "schema_version": "1.0",
    "decision": {
      "decision_id": "hermes:run-42:toolcall-7",
      "decision_type": "tool_choice",
      "evaluation_name": "agent.tool_choice_appropriate",
      "chosen": {
        "kind": "inline",
        "value": "search_database"
      }
    },
    "subject": {
      "harness": "hermes",
      "harness_version": "0.0.0-illustrative",
      "run_id": "run-42",
      "session_id": "session-9",
      "agent_id": "coder-1",
      "parent_agent_id": "orchestrator-0",
      "model": "anthropic/claude-sonnet-4.6"
    },
    "correlation": {
      "provider_response_id": "response-abc",
      "trace_id": "4bf92f3577b34da6a3ce929d0e0e4736",
      "span_id": "00f067aa0ba902b7",
      "task_id": "repair-auth-017"
    },
    "evidence": [
      {
        "evidence_id": "hermes:run-42:toolcall-7:span",
        "kind": "otel_span",
        "trace_id": "4bf92f3577b34da6a3ce929d0e0e4736",
        "span_id": "00f067aa0ba902b7"
      }
    ],
    "usage_refs": [
      "hermes:run-42:llm:response-abc"
    ],
    "metadata": {
      "environment": "benchmark"
    }
  },
  {
    "schema_version": "1.0",
    "decision": {
      "decision_id": "hermes:run-42:task:repair-auth-017",
      "decision_type": "task_completion",
      "evaluation_name": "repository.tests_pass",
      "chosen": {
        "kind": "artifact_reference",
        "value": "workspace-after-agent",
        "digest": {
          "algorithm": "sha256",
          "digest": "9f86d081884c7d659a2feaa0c55ad015a3bf4f1b2b0b822cd15d6c15b0f00a08"
        }
      }
    },
    "subject": {
      "harness": "hermes",
      "harness_version": "0.0.0-illustrative",
      "run_id": "run-42",
      "session_id": "session-9",
      "agent_id": "coder-1",
      "parent_agent_id": "orchestrator-0",
      "model": "anthropic/claude-sonnet-4.6"
    },
    "correlation": {
      "provider_response_id": "response-def",
      "trace_id": "4bf92f3577b34da6a3ce929d0e0e4736",
      "span_id": "b7ad6b7169203331",
      "task_id": "repair-auth-017"
    },
    "evidence": [
      {
        "evidence_id": "hermes:run-42:toolcall-8:command",
        "kind": "command_result",
        "command_name": "project-test-suite",
        "exit_code": 0,
        "duration_ms": 41230,
        "artifact_digest": {
          "algorithm": "sha256",
          "digest": "9f86d081884c7d659a2feaa0c55ad015a3bf4f1b2b0b822cd15d6c15b0f00a08"
        }
      },
      {
        "evidence_id": "hermes:run-42:session-end:claim",
        "kind": "harness_claim",
        "claim": {
          "success": true,
          "reason": "tests_reported_green"
        }
      }
    ],
    "usage_refs": [
      "hermes:run-42:llm:response-abc",
      "hermes:run-42:llm:response-def"
    ],
    "metadata": {
      "environment": "benchmark"
    }
  }
]
